Review_id,User_id,Product_id,Rating,Review_text,Review_date,Verified_purchase
R3HXWT0LRP0NMF,914,B09DSQXCM8,4.2,Looks durable Charging is fine tooNo complains,2023-07-20,True
R2AJM3LFTLZHFO,251,B09YV4RG4D,4.2,Charging is really fast,2024-08-25,True
R2K9EDOE15QIRJ,47,B01F25X6RQ,4.2, would recommend,2023-11-06,True
R2J3Y1WL29GWDE,598,B0814ZY6FP,4.0,Value for money,2024-09-27,True
RYGGS0M09S3KY,479,B0814ZY6FP,4.0, with extra length👍,2024-10-29,False
R1HDNOG6TO2CCA,884,B0BDRVFDKP,4.0,Product quality is good,2023-07-22,True
R3PHKXYA5AFEOU,284,B0BDYVC5TD,4.0,Good,2025-03-01,True
RWU79XKQ6I1QF,510,B0811VCGL5,3.9,Working good,2024-08-01,True
R207CYDCHJJTCJ,753,B09XJ1LM7R,3.9,Very nice product,2024-01-23,True
R3PCU8XMU173BT,98,B0BMVWKZ8G,3.9,Working well,2023-07-05,True
R3EEUZKKK9J36I,741,B07WG8PDCW,4.2,Good product,2024-02-21,True
R2DMKIBGFKBD6R,898,B08GM5S4CQ,4.2,I bought this cable for Rs.339 worthy product for this price,2023-11-08,True
R1BP4L2HH9TFUP,791,B08MWJTST6,4.2,Bought this instead of original apple,2024-04-11,True
R16PVJEXKV6QZS,216,B08FYB5HHK,4.2,does the work for 150rs,2024-08-22,True
R3KK4GT934ST3I,891,B07JZSG42Y,4.2,bought it for iPad pro 10.5 and it's working flawlessly,2023-06-09,True
RCFHMWUSBIJO,157,B07JZSG42Y,4.2, build quality is ok,2023-05-28,False
R2FRTNIIUFJE1F,193,B085CZ3SR1,4.1,Guys this cable is is best compare of everyone over heat protection,2024-02-25,True
R32ZCIH9AFNJ60,492,B07WDK3ZS2,4.3,Everything is Okay. But packaging is not good feeling like seller gave is used cable.,2023-09-22,True
R2VTSDOOUTSQ5X,580,B07WDK3ZS2,4.3,Original cable,2024-12-19,False
R3E6FZ75Q074KH,460,B078HRR1XV,4.3,I bought this cable at 129. Using this cable for Android auto in my car. Perfectly works without any glitch.,2023-12-21,True
RYQT96J8HPIXE,944,B096YCN3SD,4.3,It provided me turbo charging. I recommend for all Redmi note 10s mobile phones. As it provide turbo charging. I am veri happy with this product.,2023-05-04,True
R2F6GC79OYWUKQ,598,B0814ZY6FP,4.2, didn't have to do any setup. There's an extender cable so you can place this in a comfortable place. Get the model with antenna because otherwise you'll have range problems if you're not directly in line of sight from your wifi router.,2024-10-17,True
R3QZ19MECGWG9A,509,B0765B3TH7,4.2,The wifi dongle is a simple plug & play device,2023-07-26,True
RGIQEG07R9HS2,230,B09CTWFV5W,4.0,I ordered this cable to connect my phone to Android Auto of car. The cable is really strong and the connection ports are really well made. I already has a Micro USB cable from Ambrane and it's still in good shape. I connected my phone to the car using the cable and it got connected well and no issues. I also connected it to the charging port and yes it has Fast Charging support.,2023-07-17,True
R1SMWZQ86XIN8U,188,B09TP5KBN7,4.0,It quality is good at this price and the main thing is that i didn't ever thought that this cable will be so long it's good one and charging power is too good and also supports fast charging,2023-08-30,True
R3AAQGS6HP2QUK,636,B00BN5SNF0,4.0, working fine,2024-01-23,True
R8GBOLYUN5UP6,16,B097JQ1J5G,4.3,i think i buy these every 6 months or so. fast charging stops working after a while. probbly something to do with the cable design. the cable gets twisted over time and I suspect that breaks the high capacity wires inside. but i keep buying it because there arent too many options in an L shaped design,2025-02-09,True
R339XJL1GMKHA3,607,B095JQVC7N,4.3, USB,2023-06-13,True
R35T9LXYBSP09G,545,B095JQVC7N,4.3,Good and fast charging,2024-05-01,False
R3HJVYCLYOY554,191,B08WRBG3XW,4.2,long wire,2023-12-16,True
RC89B5IAJUTR5,479,B09G5TSGXV,4.2,i tested it in various charger adapters 33w and 18w it supports fast charging as well.,2023-06-25,True
R13WAEJDI5RS36,800,B0B3RRWSF6,4.2,Ok,2024-12-14,True
RCA1M3W4RIXUR,96,B07WGPBXY9,4.4, glad I didn’t go for cheaper options (not that it’s too costly) just plug and play. Will update if it screws up,2024-06-23,True
R3BKCLL6D7ZLIX,105,B086GVRP63,4.4,The hdmi cable is good to watch movie,2023-10-04,True
R10PB68FRUHT5V,232,B08NW8GHCJ,4.4,All good,2024-07-30,True
RARQYQ8POOFA9,432,B0BDZWMGZ1,4.2,Worth it,2024-08-31,True
R20XIOU25HEX80,265,B0949SBKMP,4.1,Loosing charging cable of apple is costly affair. This wire was great purchase made to correct it,2024-07-18,True
R2X55FA2EEUEYM,466,B09Q8HMKZX,4.1,Worked well for six months that’s it,2023-08-16,True
R1AE3A4NSVM9SC,564,B09V175NP7,4.1,Very good product. Compatible with  iPad 2nd generation  and charging very well. Quality of the product is very good and also works fine. Totally worth for its price.,2024-04-11,True
R1E7GPZ569TBIZ,544,B09V175NP7,4.1,Takes 5-6 hours to charge full.,2023-05-01,False
RQI80JG2WZXNF,743,B01LY9W8AF,4.4,Best charging power . I used this cable on note 8 pro mi. Using 8month also fast working.,2023-10-17,True
R1ZBD2ZB2ZYEWX,332,B09T39K9YL,4.4,,2024-12-29,True
R2ITEDC9KOCY3N,891,B07JZSG42Y,4.4,https://m.media-amazon.com/images/W/WEBP_402378-T1/images/I/61WnvIUaIwL._SY88.jpg,2023-11-07,True
R31OMS6DNMI7M,846,B09Y5MP7C4,4.4,Very good quality and good durability,2024-02-28,True
RHHIZ45VYU5X6,868,B0B9JZW1SQ,4.2,Useless product and useless quality. Display issues within 7 months and service center is not upto the mark. Go for better brands where quality is assured. I would wish if there was option of negative stars.,2023-07-28,True
R2WMW096T9Y0OU,368,B0B9JZW1SQ,4.2,https://m.media-amazon.com/images/I/61spXDbojZL._SY88.jpg,2023-09-19,False
R1SHIIE6M72825,258,B0B9JZW1SQ,4.2,Greater then ever,2024-12-23,False
R2TEINENXTIHT2,167,B07V82W5CN,4.2,Good 👍,2023-05-28,True
R2BP8Y5OJXKJLF,345,B09Y5MP7C4,4.1,Check for offera before buying,2023-04-14,True
R2PQNCTR8TQCT4,457,B08Y57TPDM,4.1,Awesome cable!Charging,2024-08-24,True
R3FI11UEJC9ZOJ,574,B07Q4QV1DL,4.1, data transfer and durability is simply awesome,2023-06-19,True
R3ULCCZZHBNLA4,870,B0BNQMF152,4.1, and there is not a single disconnection issue,2024-06-23,True
RELIQ4H7CYX2Q,506,B09SZ5TWHW,4.1,which I always faced in original mi cable from box. Bought 1 more time as last cable damaged when phone fell on usb cable port as my phone is heavy and I never faced any issues so i bought one more time and didn't went for replacement as its waste of time and energy,2024-04-01,True
R3ALQNTJN4ER9N,312,B0B9JZW1SQ,4.1, i also have boat earphones that is also awesome..😄,2023-09-10,False
R2PNR69G0BQG2F,818,B07DFYJRQV,4.3,LG was always Good ,2024-10-13,True
R36EHHPAQNSSOF,333,B0B9JZW1SQ,4.3, the OS has lags after about a year of use. This is the best you can get for the price tag it comes with.,2023-07-28,False
R2SQNU7OIOOLHT,580,B0B5KZ3C53,4.5,Just loved it,2024-01-28,True
R1GYK05NN6747O,887,B0B8ZM9RVV,3.7,This connector has provided as a boon for my old Samsung LCD monitor and I am proactively using that monitor as the 2nd screen just if the finishing of the product can be improved then it would be a better purchase option.,2023-07-18,True
R1J21BZ29NGQF9,61,B08TZD7FQN,3.7,Save it purpose well without any issue. I am satisfied,2024-05-20,True
R2WVVS88M7SH18,205,B0B244R4KB,3.7,GO FOR IT,2024-03-29,True
R2MQ3VB8ZTUS48,728,B07H5PBN54,3.7,It’s works properly good product but poor quality,2024-12-18,True
RBJPTKHYQ7G7U,945,B0B9JZW1SQ,3.7,I buy this product after so many reviews. this product is not so much clear. But it get the job done. you can buy to get display only. not so much clear. but still price is very good compare to other products.,2024-09-29,False
R32V7DQLDSKJ99,835,B09H39KTTB,4.3,I am calling 3 times service provider. Not meet my home address.why ? Bad bad,2023-10-12,True
R2OZPGGMUCLSC1,194,B0B9JZW1SQ,4.3,Picture quality is very poor in cables,2024-05-16,False
R3F4T5TRYPTMIG,353,B0978V2CP6,4.0,Worked on iPhone 7 and didn’t work on iPhone XR,2024-04-14,True
R3H6WKG0TA5CGU,358,B09F9YQQ7B,4.0, I use it for my work.,2024-08-20,True
R24MB66WRPSN2A,69,B0BBFJLP21,4.3, loaded with features,2024-01-02,True
R25UU2M1B9BO5X,753,B09XJ1LM7R,4.3, lightweight,2024-02-28,True
R3A3IRV8ZWP1U9,98,B0BMVWKZ8G,4.3, Set top box,2024-08-01,True
R3DYXQZQA6PPHM,119,B00E3DVQFS,4.2,The cable did not come in a box. There is no box. If this was to be shipped without any packaging or branding,2024-08-24,True
R2458DMQ9C2Z4F,247,B08RDWBYCQ,4.2, same should have been mentioned. When we pay for hi quality products,2024-04-15,True
R1XMBPKJ1QP1Q9,479,B09G5TSGXV,4.2,Bought to connect my CP monitor (CCTV) to MI android TV.. .. OK quality at this price,2023-07-16,True
R1L6PX82T6UT6P,323,B09DL9978Y,4.2,I give it a 5 on 5,2024-10-17,True
R2LK4WPIHJ7WDA,275,B0BNXFDTZ2,4.2,Prime and YouTube. It is easily installable and sign-in to start using quickly.8. It is also easy to scan the Setup box channels and start viewing them.Cons:-1. Picture quality is 776p. It's average and not very clear. But it is worth the price range. I'll not complaint as the cost of TV is very affordable and this quality is justified.2. Bluetooth and WiFi connection can disconnect sometimes and cause some issues. I encountered this disconnect issue and had to reset complete device and do the complete sign up again.Rest all is very good and loved this product. I feel it was worth ordering. If you are looking something is medium range and only need it for your old parents and don't have extensive smart use then 100% go for this.If you want to use a lot of smart features and OTT platforms and watch movies,2024-10-05,True
R6IPR9FHZ5BOT,33,B0B15GSPQW,4.2,and sports then go for better version with full HD and 4K quality. This TV will not give good experience for sports due to less picture quality but it's very good for daily family shows and TV channels.One last thing I want to express and I'm ver disappointed about is this.I got my order delivered on Friday and I scheduled my installation for Saturday. But nobody turned up that day and I had to reschedule it for Tuesday morning,2024-05-18,True
R249YCZVKYR5XD,316,B00EDJJ7FS,4.0,The product seems and works good but it's not a fast  charging cable as it has to be and when all the three ports are connected its more slower I'm charging  only good is single cable all three ports are there so its a ok product only if yiu are looking for fast charging then I would say think twice before you buyI have been using foe a while now this is for sure not a fast charging cable and in this tge lightning charger is not working properly every now and then I have to check its it charging my iPhone and I had to unplug and reply for charging its getting disconnected I don't understand how  so this cable is no ok,2023-11-16,True
R29MVX7H69YMY5,9,B09YL9SN9B,4.0,The cable looks decent with charging. But not fit for me as it does not support Apple car play,2024-01-14,True
R1Y30KU04V3QF4,595,B074CWD7MS,4.4,Fast charging.,2024-12-29,True
R1QI1HTJPGLS5O,226,B09RF2QXGX,4.4,It’s good,2023-08-14,True
R10SL1Q7F6CHBK,337,B083J64CBB,4.4,Nice product,2024-08-28,True
R1CBYX6RCGU739,750,B00TDD0YM4,4.4,I am writing this review after 10 days usage of this product and I found it very durable and sturdy. It is also good for travelling where you have to keep it in the bags without any kind of box. I would recommend it to all.,2023-10-20,True
R35RERUQG5AERU,432,B00TDD0YM4,4.3,I bought it in 2019 and it almost last three years post heavy usage... Gonna buy it again! Very good quality,2023-05-21,False
R2WKO9Y6VGUOOP,70,B07S851WX5,4.3,Great product. Wanted this as my Portable battery has USB slot and iPad and Kindle Reader have USB-C ports. Fits my requirement perfectly. Charges very fast.,2024-07-27,True
R1AFBZ5PYTHO1Z,265,B0949SBKMP,4.5,good alternative to generic cables,2023-06-25,True
R3GQL7YKAFJMEN,532,B00TDD0YM4,4.5,Strong cable,2023-05-10,False
R2Q1OYOIJI5673,753,B09XJ1LM7R,4.5, for DVR which is far above the reach limit hence I need a mouse to be connected to the USB port of the DVR which is in the rack above reachAny alternatives?Wireless mouse didn't work well with my particular DVR,2023-07-12,True
RJX2WGB0X99SY,472,B01DF26V7A,4.5, had lots of lag,2024-04-15,True
R223OIZPTZ994S,772,B00TDD0YM4,4.0,The cable build quality is good for normal charging its great cable but doesn’t support quick charging,2023-12-23,False
RHWJXUIB7QJY4,646,B07GQD4K6L,4.0,Best quality and length of wire was qute good and durability also good .,2024-05-29,True
RKKX7CGMNCZLA,386,B07GXHC691,4.0,The cable is awesome and no charging issue till now.... Because it is a braided cable... Chance of it damage are very less... Overall... I like the product 🤞🏻,2023-04-21,True
R3B3DDF1D5NULK,881,B0BFWGBX61,4.3, it doesn't bend out of shape very easily,2025-03-14,True
R3LZQDRMNS5CZO,760,B07SPVMSC6,4.3, and looks (and feels) premium. The length is definitely a plus!,2023-05-07,True
R231AEG1IO02JM,201,B00V9NHDI4,4.3,It's been 1 month that i am using this charging cable,2023-10-18,True
RD31MI3UMAXP8,287,B07VNFP3C2,4.3,works very well with S20 FE 5G. Thumbs up.,2023-05-24,True
R3EGXE69JQH9AG,934,B0BDRVFDKP,4.3,  and also short,2023-05-30,True
RCX9JVSY2ISRL,636,B00TDD0YM4,4.3,I am using from 2 months and charging the phone in good way and it's really value for money.. i recommend this cable.,2024-01-25,False
R2VQFSALVKRALF,27,B08S74GTBT,4.3,The cable is perfect for 3A charging devices . Support super fast charging and can be used in vehicle chargers and adapters. sturdy and durable for daily use,2023-05-20,True
R1Q323BB35OP30,971,B09939XJX8,3.9,It's a good data cable and I recommend it to purchase,2024-01-11,True
RJ0CSQUUWFF9W,440,B0BHVPTM2C,3.9,the only issue was the metal pin is not fixed firmly so it has become loose,2023-07-25,True
RFF7U7MPQFUGR,712,B09BVCVTBC,3.9,Very good item strong and useful USB cableValue for moneyThanks to amazon and producer,2023-04-10,True
R18MP1KLUE18PC,884,B0BDRVFDKP,3.9,Nice product and useful product,2024-08-21,True
RWGJNVEH5ZQME,16,B097JQ1J5G,3.9,-,2024-02-01,True
R1XN72FU6Q37IH,646,B07GQD4K6L,3.9,Sturdy but does not support 33w charging,2025-02-16,True
R213ILI3XNVHQ0,207,B07RY2X9MP,4.4,Good budget mfi certified lightly cable for this price . Update usage review after 3 to 5 months .,2024-11-24,True
R1EBFTZINSJ0LG,289,B08GM5S4CQ,4.4,The charger is a great carry on accessory while travelling without risking the original charger.Price is also very affordable and charging speed is very good with good adaptor or power bank.,2023-12-18,True
R3BKR3VZ1U81LW,838,B008YW8M0G,4.4,Good product ,2024-12-19,True
R5OJ20F8H5T8U,305,B008YW3CYM,4.4, can recommend all ,2023-11-07,True
RW294SCHB5QTK,898,B08GM5S4CQ,4.0,It does the job really well. No complaints regarding the charging power. At a price of Rs. 199/-,2023-06-15,True
R2WGLZMFMUHY4G,582,B088Z1YWBC,4.0, and it does the same job as the original one.,2023-05-29,True
R26YQ2I8VG8AXE,452,B08VB57558,4.0,Sturdily built. Does its job well. Charged my Samsung Galaxy M51 quicker than the original cable. Hope it stays the same going ahead.,2023-09-28,True
R2J3Q3BUHJ2S7E,877,B0B1YZX72F,4.2,I am posting this after a few weeks of using the product.Usage: Continuous,2024-11-08,True
R1U1S7X7BPSZBU,144,B08FD2VSD9,4.2,no Cable/Dish operator.Average daily usage: 6-8 hours.The TV is a great value-for-money product.Installation: The installation was simple and Amazon assisted installation was smooth,2025-01-20,True
RLEFI0WUITF14,951,B09H3BXWTK,4.2, the output,2023-11-27,True
R3H7SAJ305WZL4,112,B07LFWP97N,4.2,Cable is good and well built. it supports all sort of charging protocols. But Samsung galaxy s8 ultra seems to have some issues. It falls back to slower charging after a second or two of ultra fast charging when plugged in. It works fine with other devices just fine.,2024-05-23,True
R331DK9D3GC0XJ,86,B0B4DT8MKT,4.2, i may not have the need to buy another cable again,2024-04-18,True
R23FRK2ABESQGU,572,B09LH32678,4.5,Bought it before one and a half month.... Works well.. Satisfied...🙂,2023-05-26,True
R2PZRPBF9ZAOMA,603,B09NNJ9WYM,4.5, and cheap price,2024-05-26,True
R2BBEAL7JZWXYR,881,B00TDD0YM4,4.5,Works with my Casio ct-x700 well,2023-04-22,False
R1BIBCTNJPJOX3,441,B0BBW521YC,4.3, then DO NOT unbox the tv until MI representative arrives.This ensures,2023-11-22,True
R2RRCA47QEK9C1,778,B0B9BXKBC7,4.3, that if TV is damaged in transportation,2023-07-15,True
R2YKPF09C6G76,381,B08R69WBN7,4.3, but can be Side-loaded !!!@ To use your Set top box with android interface,2024-02-16,True
R1KD19VHEDV0OR,54,B09XB7DPW1,4.2,Till now satisfied with the quality.,2024-08-26,True
R39GQRVBUZBWGY,466,B09Q8HMKZX,4.2,Good quality,2024-04-22,True
R1O4Z15FD40PV5,736,B0B2CWRDB1,4.0,Look-wise,2025-03-06,True
R20FTANBPFA653,261,B0B25DJ352,4.0,The sturdiness will depend on the manner of its use. But its speed of charging is great. Very good product for the average income group.,2024-08-20,True
RTATA9H2ELJ81,845,B00HVXS7WC,3.3,Although it is written fast charging. However it charges quite slow compared to original chargers,2023-06-20,True
R3B46JNPC2T4E7,658,B07Q7561HD,4.1,Overall good and a better experience,2023-07-11,True
R3HHJCTEJ7J9CS,5,B0B3N7LR6K,4.1,It funcions properly and useful to me.,2023-08-15,True
R2LOAPI3SK4RCX,188,B09TP5KBN7,4.1,I you want to buy it for CP Plus Orange DVR,2024-06-25,True
R1MLGZDQDKIVIF,907,B07S9M8YTY,4.1, it works.,2024-06-26,True
R1FKOKZ3HHKJBZ,909,B07F1T31ZZ,4.4,I am using it for 14 days now. The experience is pretty good as of now. Picture quality is also not bad. Don't expect something out of the world at this price point. But you can go for it if you have a tight budget.,2024-06-19,True
R2WNMZI1EXTA0H,7,B09NVPSCQT,4.4,Initial impressions: works as said,2024-10-17,True
R3E42NTD6HXN1Q,275,B0BNXFDTZ2,3.6,Works well. Will comment on durability after using it for a few months.,2023-08-22,True
R1BBQYI4QO69ID,415,B09L835C3V,3.6,we have an expensive samsung TV.TV is great but original remote started draining battery and we had to put in new battery every 5 days which was not ideal.replacing with original remote is a costly affair ( 4k ?)this is a good cheap replacement- has all the functionalities except voice (which we rarely use),2024-05-31,True
R22EUJ1B1AM0OU,660,B091V8HK8Z,4.2,ABOUT  AMAZONBASICS:xxxxxxxxxxxxxxxxxxxxxxxxxxxxxxAmazon Basics was launched in 2009 & is Amazon’s own inhouse brand for fast moving small electronic consumer goods.Here amazon uses its massive collection of sales data to launch products that are in huge demand & already exist in the market- but at lower prices. Simply put up a similar replica for something successful but at much affordable prices.If something isn’t an immediate hit,2024-04-16,True
R2K89RVGN8N9MO,696,B012MQS060,4.2, Amazon pulls it and moves on.Amazon otherwise is like an online marketplace where it provides a portal for various sellers to sell their product BUT with amazonbasics - Amazon is selling its own product at its own marketplace .Here it derives the benefit of eliminating any intermediate distributors or retailers & hence amazonbasics branded products are available for a lower price attracting bulk customers online.As an additional benefit,2023-04-05,True
R10J01VHCKFB42,413,B01MRARGBW,4.4, which also worked.Ultimately,2023-09-04,True
R177X9L6ND6OA7,948,B08MV82R99,4.2,Amazonbasics products are delivered free to prime members & are covered under amazon warranty for all and hence any claim or replacement procedures are highly streamlined & immediately taken care of.ABOUT OUR PRODUCT ( REQUIREMENT vs ACTUAL):xxxxxxxxxxxxxxxxxxxxxxxxxxxxxxxxxxxxxxxxxxxxxxxxxxxxxxI recently purchased a new Qualcomm 3 Qbix car charger & was looking for a cable with USB A to Micro B connector. I listed my priorities under various heads to come up with a conclusion and let us compare the actual product based upon my initial requirements:1.) DATA EXCHANGE:*****************************Since it was to be primarily used for fast mobile devices charging in car,2024-11-16,True
R1HAZS2PLM3RRQ,554,B0BMGG6NKT,4.2,reasonable thickness & a sturdy intermediate cable. The whole construction of the cable due it’s cable size & flexibility is almost tangle-free.The associated cable was not exactly thick but can’t be termed as thin or delicate too. It’s not the thickest I’ve seen but then thickest doesn’t always means most durable. Given my application it’s more than just suitable.The overall built & quality of the cable & insulation looks promising enough to last few years. Even if used for other than car charging it looks durable enough to last long.I had further shortlisted mansaa & an amkette cable for the same purpose but they were too long for my requirement.4.) COMPACT MOULDED CONNECTORS:*********************************************************Had an inclination towards moulded connectors to avoid any issues where the connectors break open exposing the terminal PCBs.ACTUAL PRODUCT : There are no complaints regarding the connectors of the actual cable. The connectors are perfectly moulded without any joints or risks of splitting open. The connector casings are further quite compact at terminals to fit in comfortably at scarce spaces.The connector ports are sturdy enough both at USB A & micro B ports. The micro B port pins lock securely onto the charging mobile devices which is quite good.No signs of loose construction.Being Gold-plated is more of a misleading & fancy term(in this case) as most of the metal ports designed today already have a corrosion resistance & nobody is going to use them in saline sea water anyways.5.) AVAILABILITY OF TIES/VELCRO STRAPS :***********************************************************As per my intended use in a car where compactness was of paramount importance,2024-06-20,True
R1Q0PEVL6X8WZJ,972,B00TDD0YM4,4.3,It cost should be under Rs. 500,2024-07-27,False
RW0MMI9AUXK5J,868,B00TDD0YM4,4.3,Buy it,2023-10-23,False
R2SB3XYC8XHNUQ,888,B09MZCQYHZ,4.3,Length of the cable is long so that you can happily use it for long distance as week and quality is really good,2023-03-23,True
RFZ1X95QMXWFZ,357,B0B4DT8MKT,4.2,I got this for 6k. At this price point,2024-09-14,True
RSWY4LT0L7TCL,265,B0949SBKMP,4.2, I'd say,2024-06-09,True
R2GEJ1MJF28QVM,55,B07H5PBN54,4.2, for a small room,2023-07-04,True
R2K5NT5XE6LM6T,87,B0088TKTY2,4.2,it's a 7/10.,2025-01-21,True
R3HB3IY6922TUM,219,B06XGWRKYT,4.2, Satisfied with the product till now,2023-04-13,True
R3A3CEQUX9QMFE,671,B097JQ1J5G,4.2,This Led tv low budget Good 👍 Performance but picture & audio not good,2025-03-08,True
R3PZ3ENFIS7IJG,909,B07F1T31ZZ,4.1,Useful product in this price.,2024-01-13,True
RJB32KHP5D5O3,636,B00BN5SNF0,3.7,Purchased from Seller: Smart Place Store;Remote works but low build quality. Not original.,2024-01-04,True
R1EKLLUH4KRRS9,222,B08H5L8V1L,3.7,Works as described,2024-03-25,True
R2ZOR8P02Z5J8F,671,B097JQ1J5G,3.7,It's a good product.,2024-12-26,True
R33DVXFB4VYPZZ,323,B09DL9978Y,4.2, no additional installations/ softwares requires. Signal strength is good.... just wonder what would be different in other adapters of lesser known brands which are available at a much more competitive pricing,2023-06-06,True
R1SQ7OGFR4JRUR,999,B09W9V2PXG,4.2, hence a star less.,2023-09-07,True
R3G7X6LSJFGFXP,152,B0B298D54H,4.2,Quick not charger🤏,2024-07-10,True
R4LNZP9RCX3H3,27,B08S74GTBT,4.3,Good data cable same as shown in pic. I brought this for my Nikon d5600 photos transfer to system.,2024-10-11,True
R3TL5BYHCMQSB3,193,B085CZ3SR1,4.3,Superb product...👌👌👌,2024-12-23,True
R1B2BRD05LJZX4,979,B0088TKTY2,4.3,Better,2024-08-17,True
R2WQKUAV6WUQ06,247,B08RDWBYCQ,4.3,Seems to fast charge at 2A,2024-04-11,True
R1BQE9L2M5L12J,483,B00TDD0YM4,3.7,Works very well with Airtel DTH. The pairing is as same as every Airtel DTH remote. All the buttons works properly.,2024-02-07,False
R369X3BEG4QPC4,958,B00TDD0YM4,3.7,Nice,2024-05-16,False
R1A0NYJ6MOX3U3,289,B08GM5S4CQ,3.7,ok,2023-11-01,True
R3RYEYCYNV47BZ,751,B08J7VCT12,3.7,Poor quality! Stopped working in a month,2023-10-26,True
R28TZ1RZWX14PP,409,B08CDKQ8T6,3.7,This remote will work only for the new TV and not able to connect even follow all the procedure mentioned on guide.,2023-07-19,True
RNGN2ZRL685Z5,774,B09MKG4ZCM,3.7,You need to sync with original tv remote to make volume,2024-05-12,True
R3RUBB6REUGTT,671,B097JQ1J5G,4.3,"Before finalizing the AUE60 55""",2025-01-09,True
R281851EB9L5G6,216,B08FYB5HHK,4.3,I visited Croma and Vijay Sales to check for the same TV or similar models for their features and picture quality. I was told AUE60 & AUE70(the models listed here as Crystal 4K and 4K Pro) are E-commerce exclusive models,2024-04-20,True
R18455FQDOCS3H,612,B07F1P8KNV,4.3, panel and features,2024-12-11,True
R3IFT4P8VHQGL3,848,B08VB2CMR3,4.3,and save ~20k.Why I went for AUE60  vs. AUE70 - I knew I wouldn't be needing a voice assistant,2023-10-22,True
R1DSJOGV3DFZK2,446,B07924P3C5,4.3,and wanted to save 3k. I knew even if I wanted a voice assistant,2023-10-04,True
RZJR37WFGXR9B,96,B07WGPBXY9,4.0,i am writing this review after 2 months,2024-01-17,True
R3NHUC9S00KIR8,188,B09TP5KBN7,4.0, no issues,2023-12-12,True
R30ZSNYE78E0O2,254,B08T8KWNQ9,4.0,using it to charge me PS3 controller,2024-01-26,True
R1UJ8BCYXWICT8,990,B07S851WX5,4.0, at a good price,2024-06-14,True
R34RH86MGL4HFB,953,B0B21C4BMX,4.0, planning to pick up another one as a spare.,2024-07-06,True
R37S13YALMRPGK,394,B09R1YFL6S,4.2,Not too good not too bad,2024-07-06,True
R1B861YJE8YL2B,624,B081RLM75M,4.2,I'm using this cable since 1 years and currently this cable is running perfectly without any problems.If you want to buy best type-c cable then without thinking buy it.,2023-05-15,True
R3CR9H6ABJ4Q4O,269,B07VJ9ZTXS,4.2,Worth the price. I use the local cable providers set up. With my previous tv (Samsung) I was not facing this problem.  The only problem I am facing is each time I turn off the tv from the mains,2023-12-10,True
